[
  {
    "category": "file-management",
    "id": "awesome-selfhosted-file-managers",
    "kind": "resource",
    "name": "Awesome Selfhosted — web file managers",
    "schema_version": 1,
    "summary": "Directory of browser-based, self-hosted file management projects.",
    "tags": [
      "selfhosted",
      "file-manager",
      "directory"
    ],
    "verification": {
      "checked_on": "2026-10-24",
      "functional_tested": false,
      "level": "repository-listing",
      "source": "https://github.com/ami3go/Awsome-linux-distors/blob/main/README.md"
    },
    "website": "https://awesome-selfhosted.net/tags/file-transfer---web-based-file-managers.html"
  },
  {
    "category": "server-management",
    "id": "cockpit",
    "kind": "software",
    "name": "Cockpit",
    "schema_version": 1,
    "source_repo": "https://github.com/cockpit-project/cockpit",
    "summary": "Linux server administration through a web console.",
    "tags": [
      "headless",
      "server",
      "web-admin"
    ],
    "verification": {
      "checked_on": "2026-10-24",
      "functional_tested": false,
      "level": "official-documentation",
      "source": "https://cockpit-project.org/"
    },
    "website": "https://cockpit-project.org/"
  },
  {
    "category": "server-management",
    "ecosystem": "cockpit",
    "group": "red-hat",
    "id": "cockpit-389-directory-server",
    "kind": "extension",
    "name": "389 Directory Server",
    "package_availability": "unverified",
    "package_name": "cockpit-389-ds",
    "schema_version": 1,
    "source_repo": "https://github.com/389ds/389-ds-base",
    "source_section": "Red Hat-developed",
    "summary": "389 Directory Server LDAP UI; source project linked",
    "tags": [
      "cockpit",
      "red-hat"
    ],
    "verification": {
      "checked_on": "2026-10-19",
      "functional_tested": false,
      "level": "research-snapshot",
      "source": "https://github.com/ami3go/Awsome-linux-distors/blob/main/COCKPIT_PLUGINS.md"
    }
  },
  {
    "category": "server-management",
    "ecosystem": "cockpit",
    "group": "cockpit-listed-third-party",
    "id": "cockpit-backblaze-b2-backup",
    "kind": "extension",
    "name": "Backblaze B2 Backup",
    "package_availability": "unverified",
    "package_name": null,
    "schema_version": 1,
    "source_repo": "https://github.com/rabol/backblaze-b2",
    "source_section": "Third-party plugins indexed by Cockpit",
    "summary": "Backblaze B2 backup UI",
    "tags": [
      "cockpit",
      "cockpit-listed-third-party"
    ],
    "verification": {
      "checked_on": "2026-10-19",
      "functional_tested": false,
      "level": "research-snapshot",
      "source": "https://github.com/ami3go/Awsome-linux-distors/blob/main/COCKPIT_PLUGINS.md"
    }
  },
  {
    "category": "server-management",
    "ecosystem": "cockpit",
    "group": "cockpit-listed-third-party",
    "id": "cockpit-benchmark",
    "kind": "extension",
    "name": "Benchmark",
    "package_availability": "unverified",
    "package_name": null,
    "schema_version": 1,
    "source_repo": "https://github.com/45Drives/cockpit-benchmark",
    "source_section": "Third-party plugins indexed by Cockpit",
    "summary": "Storage benchmarking",
    "tags": [
      "cockpit",
      "cockpit-listed-third-party"
    ],
    "verification": {
      "checked_on": "2026-10-19",
      "functional_tested": false,
      "level": "research-snapshot",
      "source": "https://github.com/ami3go/Awsome-linux-distors/blob/main/COCKPIT_PLUGINS.md"
    }
  },
  {
    "category": "server-management",
    "ecosystem": "cockpit",
    "group": "cockpit-listed-third-party",
    "id": "cockpit-bind-dns",
    "kind": "extension",
    "name": "BIND DNS",
    "package_availability": "unverified",
    "package_name": null,
    "schema_version": 1,
    "source_repo": "https://github.com/josephoaks/Cockpit-DNS_Bind",
    "source_section": "Third-party plugins indexed by Cockpit",
    "summary": "BIND DNS management",
    "tags": [
      "cockpit",
      "cockpit-listed-third-party"
    ],
    "verification": {
      "checked_on": "2026-10-19",
      "functional_tested": false,
      "level": "research-snapshot",
      "source": "https://github.com/ami3go/Awsome-linux-distors/blob/main/COCKPIT_PLUGINS.md"
    }
  },
  {
    "category": "server-management",
    "ecosystem": "cockpit",
    "group": "suse",
    "id": "cockpit-bootloader",
    "kind": "extension",
    "name": "Bootloader",
    "package_availability": "unverified",
    "package_name": "cockpit-bootloader",
    "schema_version": 1,
    "source_repo": "https://github.com/openSUSE/cockpit-bootloader",
    "source_section": "SUSE/openSUSE-developed",
    "summary": "Bootloader configuration; pre-release",
    "tags": [
      "cockpit",
      "suse"
    ],
    "verification": {
      "checked_on": "2026-10-19",
      "functional_tested": false,
      "level": "research-snapshot",
      "source": "https://github.com/ami3go/Awsome-linux-distors/blob/main/COCKPIT_PLUGINS.md"
    }
  },
  {
    "category": "server-management",
    "ecosystem": "cockpit",
    "group": "independent-third-party",
    "id": "cockpit-caddy",
    "kind": "extension",
    "name": "Caddy",
    "package_availability": "unverified",
    "package_name": "cockpit-caddy",
    "schema_version": 1,
    "source_repo": "https://github.com/RXTX4816/cockpit-caddy",
    "source_section": "Additional independently discovered third-party plugins",
    "summary": "Caddy reverse proxy; supports Debian .deb; requires Cockpit 300+",
    "tags": [
      "cockpit",
      "independent-third-party"
    ],
    "verification": {
      "checked_on": "2026-10-19",
      "functional_tested": false,
      "level": "research-snapshot",
      "source": "https://github.com/ami3go/Awsome-linux-distors/blob/main/COCKPIT_PLUGINS.md"
    }
  },
  {
    "category": "server-management",
    "ecosystem": "cockpit",
    "group": "cockpit-listed-third-party",
    "id": "cockpit-cloudflare-tunnels",
    "kind": "extension",
    "name": "Cloudflare tunnels",
    "package_availability": "unverified",
    "package_name": "cockpit-cloudflared",
    "schema_version": 1,
    "source_repo": "https://github.com/spotsnel/cockpit-cloudflared",
    "source_section": "Third-party plugins indexed by Cockpit",
    "summary": "Cloudflared status; pre-release",
    "tags": [
      "cockpit",
      "cockpit-listed-third-party"
    ],
    "verification": {
      "checked_on": "2026-10-19",
      "functional_tested": false,
      "level": "research-snapshot",
      "source": "https://github.com/ami3go/Awsome-linux-distors/blob/main/COCKPIT_PLUGINS.md"
    }
  },
  {
    "category": "server-management",
    "ecosystem": "cockpit",
    "group": "historical",
    "id": "cockpit-composer",
    "kind": "extension",
    "name": "Cockpit Composer",
    "package_availability": "unverified",
    "package_name": null,
    "schema_version": 1,
    "source_repo": "https://github.com/osbuild/cockpit-composer",
    "source_section": "Legacy or historical projects (compatibility unconfirmed)",
    "summary": "Historical osbuild-composer image-building frontend",
    "tags": [
      "cockpit",
      "historical"
    ],
    "verification": {
      "checked_on": "2026-10-19",
      "functional_tested": false,
      "level": "research-snapshot",
      "source": "https://github.com/ami3go/Awsome-linux-distors/blob/main/COCKPIT_PLUGINS.md"
    }
  },
  {
    "category": "server-management",
    "ecosystem": "cockpit",
    "group": "independent-third-party",
    "id": "cockpit-container-manager-mietzen",
    "kind": "extension",
    "name": "Container Manager (mietzen)",
    "package_availability": "unverified",
    "package_name": "cockpit-container-manager",
    "schema_version": 1,
    "source_repo": "https://github.com/mietzen/cockpit-plugins",
    "source_section": "Additional independently discovered third-party plugins",
    "summary": "Docker/Podman/Compose and volumes/networks",
    "tags": [
      "cockpit",
      "independent-third-party"
    ],
    "verification": {
      "checked_on": "2026-10-19",
      "functional_tested": false,
      "level": "research-snapshot",
      "source": "https://github.com/ami3go/Awsome-linux-distors/blob/main/COCKPIT_PLUGINS.md"
    }
  },
  {
    "category": "server-management",
    "ecosystem": "cockpit",
    "group": "first-party",
    "id": "cockpit-diagnostic-reports",
    "kind": "extension",
    "name": "Diagnostic Reports",
    "package_availability": "unverified",
    "package_name": "cockpit-sosreport",
    "schema_version": 1,
    "source_repo": "https://github.com/cockpit-project/cockpit",
    "source_section": "Cockpit project (first-party)",
    "summary": "System diagnostic collection",
    "tags": [
      "cockpit",
      "first-party"
    ],
    "verification": {
      "checked_on": "2026-10-19",
      "functional_tested": false,
      "level": "research-snapshot",
      "source": "https://github.com/ami3go/Awsome-linux-distors/blob/main/COCKPIT_PLUGINS.md"
    }
  },
  {
    "category": "server-management",
    "ecosystem": "cockpit",
    "group": "cockpit-listed-third-party",
    "id": "cockpit-docker-compose",
    "kind": "extension",
    "name": "Docker Compose",
    "package_availability": "unverified",
    "package_name": "cockpit-compose",
    "schema_version": 1,
    "source_repo": "https://github.com/RXTX4816/cockpit-compose",
    "source_section": "Third-party plugins indexed by Cockpit",
    "summary": "Docker/Podman Compose; indexed pre-release",
    "tags": [
      "cockpit",
      "cockpit-listed-third-party"
    ],
    "verification": {
      "checked_on": "2026-10-19",
      "functional_tested": false,
      "level": "research-snapshot",
      "source": "https://github.com/ami3go/Awsome-linux-distors/blob/main/COCKPIT_PLUGINS.md"
    }
  },
  {
    "category": "server-management",
    "ecosystem": "cockpit",
    "group": "cockpit-listed-third-party",